{
  "schema_version": "project-state-record/v5",
  "project": {
    "name": "Arckit Skill Repository",
    "status": "active",
    "intent": "治理 Arckit skill 体系，使其同时支撑 Codex 类人机协作和自动化平台的软件开发接力协议。",
    "created_at": "2026-07-05T13:32:43.579Z",
    "updated_at": "2026-09-17T11:14:34.892385Z",
    "revision": 396
  },
  "advancement": {
    "active_iteration_ref": "arckit/project/iterations/ITER-20260705-001-state-driven-loop-foundation.record.json",
    "active_case_refs": [],
    "project_gaps": [],
    "selection_context": {
      "current_focus": "Apply approved grouped navigation, independent Thing, centered Chat and existing account capabilities to production ArcOrbit.",
      "project_priorities": [
        "Keep skills generic while Project State owns the concrete software-definition checklist and decisions.",
        "Let one Agent select dynamic gaps from all current facts without facet workflows.",
        "Apply relevant Project State changes atomically in the Gap transition that establishes them."
      ]
    }
  },
  "software_definition": {
    "summary": "Arckit is a state-driven software-development protocol and optional supervised Runtime. Project State owns explicit software-definition decisions; one Agent advances facts and dynamic gaps through trusted atomic ledger transitions.",
    "decision_areas": [
      {
        "id": "product_intent_and_scope",
        "question": "What problem does the software solve, for whom, with what success outcome and scope boundary?",
        "decision_expectation": "State the project outcome, intended users, primary scenarios, success basis, and important non-goals.",
        "evidence_expectation": "Durable product evidence sufficient to recover the intended outcome and scope.",
        "decision": {
          "status": "settled",
          "statement": "Arckit is the repository-owned development protocol and skill system; ArcOrbit is its supervised Desktop/Runtime product and is expanding into a local-project-anchored, multi-product software-development platform for people who coordinate organization, product, member, todo, AI execution, and feedback work without relying on the Todo or Feedback web clients for daily operation. Product 保持产品资料推进能力；Product/Idea 能力保持既有边界。 Release 提供真实本地终端、原生 Git、源码编辑、构建运行及复用 Chat/Idea 的场景 Agent，消费既有工作区绑定；以 arcorbit-release-workspace.md 与 release-workspace-solution.md 为准，外部渠道和监控仍依实际 adapter。 ArcOrbit 的 Thing 是与 Chat 并列的独立入口；四组主导航直接访问全部业务页面，默认进入 Automation。",
          "reason": "用户明确收窄事情台到独立页面；已批准原型与当前生产导航实现。",
          "evidence": [
            "arckit/spec/agentic-software-development/arcorbit-platform-capabilities.md",
            "arckit/pending/prototypes/arcorbit-platform-next/README.md",
            "arckit/spec/agentic-software-development/arcorbit-product-management.md",
            "arckit/spec/agentic-software-development/arcorbit-planned-workspaces.md",
            "runtime/arcorbit/src/chat-coordinator.mjs",
            "runtime/arcorbit/src/platform-coordinator.mjs",
            "arckit/spec/agentic-software-development/arcorbit-release-workspace.md",
            "arckit/tech/arcorbit/release-workspace-solution.md",
            "arckit/interaction/release-workspace/interaction.md",
            "arckit/interaction/release-workspace/default.html",
            "arckit/cases/evidence/CASE-20260915-001/verification.md",
            "arckit/cases/evidence/CASE-20260915-001/acceptance-matrix.md",
            "arckit/spec/agentic-software-development/arcorbit-project-workbench.md",
            "arckit/interaction/project-workbench/interaction.md",
            "arckit/tech/arcorbit/project-workbench-solution.md",
            "arckit/cases/evidence/CASE-20260917-001/navigation-electron.json"
          ],
          "confidence": "high",
          "resume_condition": "Revisit only if the server ownership boundary or protected ArcOrbit Runtime semantics change. 事情身份、主会话、场景所有权或新旧导航边界变化时重审。",
          "revision": 7
        },
        "gap_refs": []
      },
      {
        "id": "product_capabilities",
        "question": "What core product capabilities must the software provide?",
        "decision_expectation": "State the capability set, the problem each capability solves, and important capabilities intentionally excluded.",
        "evidence_expectation": "Durable product evidence sufficient to recover the capability decisions.",
        "decision": {
          "status": "settled",
          "statement": "ArcOrbit 保留既有 Desktop、Runtime、Chat、Automation、Feedback、Work、Setup、Today、Product/Idea 与 Release 能力及既有边界。ArcOrbit 账号与 Runtime 设置分别维护当前设备 Chat 与 Automation 的 Codex Model/Level 默认值：动态候选来自当前 Codex，四个字段始终可人工输入；查询失败或未知当前值不阻止保存。两组缺省均为 gpt-6-astra / high，旧单组有效值迁移为两组初始值，随后独立保存。新 Chat 会话继承 Chat 默认值并可在 Composer 快速调整当前会话后续消息；Automation Run 只读取 Automation 默认值。已接受 Chat turn 与已启动 Run 固定配置，Chat 保持原 thread，任一场景调整不污染另一场景。Engineering 是高密度 ArcOrbit 内置 Skills 安装后管理页面，只管理可信随包 Skills 在 Chat 与 Automation 的使用方式；用户级、项目级、其他 catalog 和本地目录 Skills 不显示且不能通过 Engineering 操作。Setup Readiness 继续独占内置 Skills 的安装、更新、漂移恢复和清理。其他既有 Work、Feedback、Project Catalog、本地工作区绑定、Automation participation、Codex Setup、Today、Product/Idea 与 Release 契约保持不变。 ArcOrbit 各处 Agent 执行统一受设备级 settings.codex.yolo_mode 显式开关控制，缺省关闭；开启跳过审批并解除 Codex 沙箱，后续消息、新 Run 和终端接力捕获，关闭恢复场景策略；业务授权和托管权限上限保持有效。 新增独立项目事情台：创建自分配待评审事情、先讨论或直接单事情 Auto、运行中消息介入与暂停讨论、结构化约定/标准/报告/上下文、成果检查与验收；旧业务能力保留。场景/软件能力工具复用原业务协调器，身份删除/跨项目替换仍走旧页面。",
          "reason": "用户确认最终项目事情台并授权独立实现及保留全部旧入口；生产代码和验证兑现本次变化。",
          "evidence": [
            "arckit/spec/agentic-software-development/arcorbit-scene-skills.md",
            "arckit/spec/agentic-software-development/arcorbit-planned-workspaces.md",
            "arckit/spec/agentic-software-development/arcorbit-platform-capabilities.md",
            "arckit/spec/arcorbit-distribution.md",
            "runtime/arcorbit/src/scene-skill-manager.mjs",
            "arckit/cases/evidence/CASE-20260912-002/verification.md",
            "arckit/cases/evidence/arcorbit-yolo/contract.md",
            "arckit/cases/evidence/CASE-20260915-001/verification.md",
            "arckit/cases/evidence/CASE-20260915-001/acceptance-matrix.md",
            "arckit/spec/agentic-software-development/arcorbit-project-workbench.md",
            "arckit/interaction/project-workbench/interaction.md",
            "arckit/tech/arcorbit/project-workbench-solution.md"
          ],
          "confidence": "high",
          "resume_condition": "当 Engineering 的管理对象、内置身份来源、Setup 所有权或 Chat/Automation 场景模式改变时重审。 事情身份、主会话、场景所有权或新旧导航边界变化时重审。",
          "revision": 49
        },
        "gap_refs": []
      },
      {
        "id": "runtime_surfaces",
        "question": "Which clients, applications, services, or runtime surfaces comprise the software?",
        "decision_expectation": "State which desktop, web, mobile, server, admin, CLI, extension, or other surfaces exist and the responsibility of each.",
        "evidence_expectation": "Durable evidence sufficient to recover the system surfaces and their responsibilities.",
        "decision": {
          "status": "settled",
          "statement": "The repository-owned software surfaces are Arckit skills and ledger CLIs, ArcOrbit Electron Desktop/Runtime, the Workshop Todo browser application, the Workshop Feedback developer console, the shared Workshop Todo/Feedback Go service, the embeddable Feedback Web SDK, and the iOS integration example. These sources live in one public Arckit monorepo while preserving existing Arckit and ArcOrbit paths; Workshop web clients remain optional administration and source surfaces rather than requirements for ArcOrbit daily work.",
          "reason": "The repository owner authorized consolidating the previously separate Todo and Feedback sources without changing their runtime responsibilities.",
          "evidence": [
            "arckit/tech/repository-governance/monorepo-solution.md",
            "arckit/tech/arcorbit/platform-composition-solution.md"
          ],
          "confidence": "high",
          "resume_condition": "Revisit if a new server, mobile, or hosted surface becomes repository-owned or a current surface leaves the monorepo.",
          "revision": 5
        },
        "gap_refs": []
      },
      {
        "id": "experience_and_interaction",
        "question": "How do users complete the main journeys and recover from interaction states?",
        "decision_expectation": "State the important journeys, navigation, inputs, feedback, error recovery, and accessibility expectations.",
        "evidence_expectation": "Durable interaction evidence sufficient to understand and verify affected journeys.",
        "decision": {
          "status": "settled",
          "statement": "ArcOrbit 的旧业务页面保留既有交互及恢复语义。账号设置覆盖层为 Chat 与 Automation 分别提供可编辑 Model 和 Level 候选输入，Chat Composer 在输入框附近显示并调整当前会话后续消息所用 Model/Level，保存、失败恢复、thread 连续与场景隔离保持既有契约。Engineering 以“内置 Skills”明确范围，在首屏紧凑呈现场景、生效时机、内置总数、直接发现、按需使用、已停用、搜索、状态筛选和三列列表；用户在行内调整内置 Skill 使用方式并接收原位反馈。Automation 核心可见且锁定；搜索与状态可组合并一键清除；刷新或保存失败保留最近可信列表、场景和筛选；窄窗口按两列及单列降级且保持键盘焦点。用户自行安装的 Skills 不进入页面列表、计数、错误或操作，Chat 返回保留原会话与草稿。其他既有 Work Inspector、验收、Setup、Feedback、Today、项目绑定、Product/Idea 与 Release 交互契约保持不变。 ArcOrbit 各处 Agent 执行统一受设备级 settings.codex.yolo_mode 显式开关控制，缺省关闭；开启跳过审批并解除 Codex 沙箱，后续消息、新 Run 和终端接力捕获，关闭恢复场景策略；业务授权和托管权限上限保持有效。 Thing 以跨项目事情列表、中央详情与局部消息协作承载事情处理；取消全局项目列表与旧页面二级菜单。PERSONAL 下 Today、Chat、Thing 并列，保留 PRODUCT、PRODUCT LIFECYCLE、ORGANIZATION 类别；个人中心保持全部真实设置能力。 Chat 对话与 Composer 居中，项目分组会话在右侧；窄窗抽屉，逐会话草稿、阅读位置和 thread 保持独立。",
          "reason": "用户批准 Chat 右侧会话布局并授权实施；生产行为验证通过。",
          "evidence": [
            "arckit/interaction/engineering-profile/interaction.md",
            "arckit/interaction/engineering-profile/default.html",
            "runtime/arcorbit/desktop/renderer/engineering-surface.mjs",
            "runtime/arcorbit/desktop/renderer/engineering.css",
            "runtime/arcorbit/test/engineering-surface.test.mjs",